{
  "$schema": "https://json-schema.org/draft/2020-12/schema",
  "title": "Git Platform Evidence Engine canonical bundle",
  "type": "object",
  "additionalProperties": true,
  "required": [
    "schema_version",
    "run",
    "providers",
    "repositories",
    "actors",
    "work_items",
    "change_requests",
    "interactions",
    "commits",
    "ref_changes",
    "releases",
    "evidence",
    "facts",
    "coverage"
  ],
  "properties": {
    "schema_version": {"const": "0.1"},
    "run": {"$ref": "#/$defs/run"},
    "providers": {"type": "array", "items": {"$ref": "#/$defs/entity"}},
    "repositories": {"type": "array", "items": {"$ref": "#/$defs/entity"}},
    "actors": {"type": "array", "items": {"$ref": "#/$defs/entity"}},
    "work_items": {"type": "array", "items": {"$ref": "#/$defs/entity"}},
    "change_requests": {"type": "array", "items": {"$ref": "#/$defs/entity"}},
    "interactions": {"type": "array", "items": {"$ref": "#/$defs/entity"}},
    "commits": {"type": "array", "items": {"$ref": "#/$defs/entity"}},
    "ref_changes": {"type": "array", "items": {"$ref": "#/$defs/ref_change"}},
    "releases": {"type": "array", "items": {"$ref": "#/$defs/entity"}},
    "evidence": {"type": "array", "items": {"$ref": "#/$defs/evidence"}},
    "facts": {"type": "array", "items": {"$ref": "#/$defs/fact"}},
    "coverage": {"$ref": "#/$defs/coverage"}
  },
  "$defs": {
    "entity": {
      "type": "object",
      "required": ["id"],
      "properties": {"id": {"type": "string", "minLength": 1}},
      "additionalProperties": true
    },
    "run": {
      "type": "object",
      "required": ["run_id", "window", "scope"],
      "properties": {
        "run_id": {"type": "string", "minLength": 1},
        "window": {
          "type": "object",
          "required": ["start", "end", "timezone"],
          "properties": {
            "start": {"type": "string", "format": "date-time"},
            "end": {"type": "string", "format": "date-time"},
            "timezone": {"type": "string", "minLength": 1}
          },
          "additionalProperties": true
        },
        "scope": {
          "type": "object",
          "required": ["repositories"],
          "properties": {
            "repositories": {"type": "array", "minItems": 1, "items": {"type": "string", "minLength": 1}},
            "actors": {"type": "array", "items": {"type": "string"}}
          },
          "additionalProperties": true
        }
      },
      "additionalProperties": true
    },
    "evidence": {
      "type": "object",
      "required": ["id"],
      "properties": {
        "id": {"type": "string", "minLength": 1},
        "url": {"type": "string", "format": "uri"},
        "source_ref": {"type": "string", "minLength": 1}
      },
      "anyOf": [{"required": ["url"]}, {"required": ["source_ref"]}],
      "additionalProperties": true
    },
    "fact": {
      "type": "object",
      "required": ["id", "evidence_ids"],
      "properties": {
        "id": {"type": "string", "minLength": 1},
        "evidence_ids": {"type": "array", "minItems": 1, "items": {"type": "string", "minLength": 1}},
        "occurred_at": {"type": "string", "format": "date-time"}
      },
      "additionalProperties": true
    },
    "ref_change": {
      "allOf": [
        {"$ref": "#/$defs/entity"},
        {
          "type": "object",
          "required": ["change_association"],
          "properties": {
            "change_association": {"enum": ["linked", "unlinked", "ambiguous", "unknown"]}
          }
        }
      ]
    },
    "coverage_diagnostics": {
      "type": "object",
      "properties": {
        "failure_class": {
          "enum": [
            "permission_denied",
            "rate_limited",
            "service_error",
            "not_found",
            "request_rejected",
            "malformed_response",
            "network_error",
            "transport_error",
            "fixture_missing",
            "http_error"
          ]
        },
        "failure_classes": {
          "type": "array",
          "minItems": 1,
          "items": {
            "enum": [
              "permission_denied",
              "rate_limited",
              "service_error",
              "not_found",
              "request_rejected",
              "malformed_response",
              "network_error",
              "transport_error",
              "fixture_missing",
              "http_error"
            ]
          }
        },
        "status_code": {"type": "integer"},
        "attempts": {"type": "integer", "minimum": 1},
        "retryable": {"type": "boolean"},
        "retry_after_seconds": {"type": "number", "minimum": 0}
      },
      "additionalProperties": true
    },
    "coverage": {
      "type": "object",
      "required": ["required_sources", "observations", "fatal", "allow_publish"],
      "properties": {
        "required_sources": {"type": "array", "items": {"type": "string"}},
        "observations": {
          "type": "array",
          "items": {
            "type": "object",
            "required": ["source", "status"],
            "properties": {
              "source": {"type": "string", "minLength": 1},
              "status": {"enum": ["supported", "unsupported", "unavailable", "incomplete"]},
              "diagnostics": {"$ref": "#/$defs/coverage_diagnostics"}
            },
            "additionalProperties": true
          }
        },
        "fatal": {"type": "array"},
        "allow_publish": {"type": "boolean"}
      },
      "additionalProperties": true
    }
  }
}
